{
 "schema": 1,
 "session_id": "example-zhuyin-0001",
 "started_at": "2026-08-13T14:52:00+08:00",
 "consent": {
  "version": "example",
  "granted_at": "2026-08-13T14:51:00+08:00",
  "redistribution": false
 },
 "locale": {
  "language": "zh-TW",
  "script": "han-trad",
  "input_method": "zhuyin",
  "layout": "dachen"
 },
 "prompt_id": "zh-tw-daily-001",
 "prompt": "今天天氣很好我想出去走走",
 "typed": "今天天氣很好我想出去走走",
 "commits": [
  {
   "i": 0,
   "char": "今",
   "t": 248.4,
   "keys": 4,
   "code": "ㄐㄧㄣ"
  },
  {
   "i": 1,
   "char": "天",
   "t": 520.1,
   "keys": 4,
   "code": "ㄊㄧㄢ"
  },
  {
   "i": 2,
   "char": "天",
   "t": 772.2,
   "keys": 4,
   "code": "ㄊㄧㄢ"
  },
  {
   "i": 3,
   "char": "氣",
   "t": 1205.7,
   "keys": 3,
   "code": "ㄑㄧˋ"
  },
  {
   "i": 4,
   "char": "很",
   "t": 1521.6,
   "keys": 3,
   "code": "ㄏㄣˇ"
  },
  {
   "i": 5,
   "char": "好",
   "t": 1802.6,
   "keys": 3,
   "code": "ㄏㄠˇ"
  },
  {
   "i": 6,
   "char": "我",
   "t": 2084.8,
   "keys": 3,
   "code": "ㄨㄛˇ"
  },
  {
   "i": 7,
   "char": "想",
   "t": 2434.8,
   "keys": 4,
   "code": "ㄒㄧㄤˇ"
  },
  {
   "i": 8,
   "char": "出",
   "t": 2884.3,
   "keys": 3,
   "code": "ㄔㄨ"
  },
  {
   "i": 9,
   "char": "去",
   "t": 3206.4,
   "keys": 3,
   "code": "ㄑㄩˋ"
  },
  {
   "i": 10,
   "char": "走",
   "t": 3572.7,
   "keys": 3,
   "code": "ㄗㄡˇ"
  },
  {
   "i": 11,
   "char": "走",
   "t": 3789.6,
   "keys": 3,
   "code": "ㄗㄡˇ"
  }
 ],
 "events": [
  [
   0.0,
   "D",
   "KeyR",
   "ㄐ"
  ],
  [
   84.1,
   "U",
   "KeyR",
   "ㄐ"
  ],
  [
   528.7,
   "D",
   "KeyU",
   "ㄧ"
  ],
  [
   608.7,
   "D",
   "Digit0",
   "ㄢ"
  ],
  [
   637.9,
   "U",
   "KeyU",
   "ㄧ"
  ],
  [
   669.0,
   "U",
   "Digit0",
   "ㄢ"
  ],
  [
   707.8,
   "D",
   "Space",
   " "
  ],
  [
   815.6,
   "U",
   "Space",
   " "
  ],
  [
   823.5,
   "D",
   "KeyW",
   "ㄊ"
  ],
  [
   887.7,
   "D",
   "KeyU",
   "ㄧ"
  ],
  [
   931.7,
   "U",
   "KeyW",
   "ㄊ"
  ],
  [
   943.2,
   "D",
   "Digit0",
   "ㄢ"
  ],
  [
   983.7,
   "U",
   "KeyU",
   "ㄧ"
  ],
  [
   995.6,
   "D",
   "Space",
   " "
  ],
  [
   1027.9,
   "U",
   "Digit0",
   "ㄢ"
  ],
  [
   1100.0,
   "U",
   "Space",
   " "
  ],
  [
   1669.2,
   "D",
   "KeyR",
   "ㄐ"
  ],
  [
   1762.2,
   "U",
   "KeyR",
   "ㄐ"
  ],
  [
   1801.8,
   "D",
   "KeyU",
   "ㄧ"
  ],
  [
   1845.6,
   "D",
   "KeyP",
   "ㄣ"
  ],
  [
   1909.6,
   "U",
   "KeyU",
   "ㄧ"
  ],
  [
   1917.6,
   "D",
   "Space",
   " "
  ],
  [
   1933.6,
   "U",
   "KeyP",
   "ㄣ"
  ],
  [
   1985.2,
   "D",
   "KeyW",
   "ㄊ"
  ],
  [
   2013.6,
   "U",
   "Space",
   " "
  ],
  [
   2053.5,
   "D",
   "KeyU",
   "ㄧ"
  ],
  [
   2125.7,
   "U",
   "KeyW",
   "ㄊ"
  ],
  [
   2126.7,
   "D",
   "Digit0",
   "ㄢ"
  ],
  [
   2165.1,
   "U",
   "KeyU",
   "ㄧ"
  ],
  [
   2189.4,
   "D",
   "Space",
   " "
  ],
  [
   2217.5,
   "U",
   "Digit0",
   "ㄢ"
  ],
  [
   2286.0,
   "U",
   "Space",
   " "
  ],
  [
   2317.6,
   "D",
   "KeyW",
   "ㄊ"
  ],
  [
   2361.6,
   "D",
   "KeyU",
   "ㄧ"
  ],
  [
   2429.7,
   "D",
   "Digit0",
   "ㄢ"
  ],
  [
   2441.6,
   "D",
   "Space",
   " "
  ],
  [
   2453.3,
   "U",
   "KeyW",
   "ㄊ"
  ],
  [
   2469.7,
   "U",
   "KeyU",
   "ㄧ"
  ],
  [
   2517.6,
   "U",
   "Digit0",
   "ㄢ"
  ],
  [
   2547.6,
   "U",
   "Space",
   " "
  ],
  [
   2668.6,
   "D",
   "KeyF",
   "ㄑ"
  ],
  [
   2720.6,
   "D",
   "KeyU",
   "ㄧ"
  ],
  [
   2764.6,
   "U",
   "KeyF",
   "ㄑ"
  ],
  [
   2792.8,
   "U",
   "KeyU",
   "ㄧ"
  ],
  [
   2842.8,
   "D",
   "Digit4",
   "ˋ"
  ],
  [
   2914.5,
   "U",
   "Digit4",
   "ˋ"
  ],
  [
   3012.7,
   "D",
   "KeyC",
   "ㄏ"
  ],
  [
   3036.9,
   "D",
   "KeyP",
   "ㄣ"
  ],
  [
   3064.7,
   "U",
   "KeyP",
   "ㄣ"
  ],
  [
   3104.9,
   "U",
   "KeyC",
   "ㄏ"
  ],
  [
   3158.6,
   "D",
   "Digit3",
   "ˇ"
  ],
  [
   3246.9,
   "U",
   "Digit3",
   "ˇ"
  ],
  [
   3272.2,
   "D",
   "KeyC",
   "ㄏ"
  ],
  [
   3354.8,
   "D",
   "KeyL",
   "ㄠ"
  ],
  [
   3358.4,
   "U",
   "KeyC",
   "ㄏ"
  ],
  [
   3434.1,
   "U",
   "KeyL",
   "ㄠ"
  ],
  [
   3437.9,
   "D",
   "Digit3",
   "ˇ"
  ],
  [
   3514.9,
   "U",
   "Digit3",
   "ˇ"
  ],
  [
   3602.8,
   "D",
   "KeyJ",
   "ㄨ"
  ],
  [
   3618.6,
   "D",
   "KeyI",
   "ㄛ"
  ],
  [
   3670.1,
   "U",
   "KeyJ",
   "ㄨ"
  ],
  [
   3690.9,
   "U",
   "KeyI",
   "ㄛ"
  ],
  [
   3726.6,
   "D",
   "Digit3",
   "ˇ"
  ],
  [
   3819.0,
   "U",
   "Digit3",
   "ˇ"
  ],
  [
   3889.5,
   "D",
   "KeyU",
   "ㄧ"
  ],
  [
   3890.2,
   "D",
   "KeyV",
   "ㄒ"
  ],
  [
   3933.8,
   "D",
   "Semicolon",
   "ㄤ"
  ],
  [
   3973.6,
   "U",
   "KeyU",
   "ㄧ"
  ],
  [
   3981.4,
   "U",
   "KeyV",
   "ㄒ"
  ],
  [
   4029.5,
   "U",
   "Semicolon",
   "ㄤ"
  ],
  [
   4072.7,
   "D",
   "Digit3",
   "ˇ"
  ],
  [
   4138.5,
   "U",
   "Digit3",
   "ˇ"
  ],
  [
   4349.7,
   "D",
   "KeyT",
   "ㄔ"
  ],
  [
   4381.7,
   "D",
   "KeyJ",
   "ㄨ"
  ],
  [
   4421.7,
   "U",
   "KeyT",
   "ㄔ"
  ],
  [
   4449.3,
   "U",
   "KeyJ",
   "ㄨ"
  ],
  [
   4511.6,
   "D",
   "Space",
   " "
  ],
  [
   4599.9,
   "U",
   "Space",
   " "
  ],
  [
   4640.7,
   "D",
   "KeyF",
   "ㄑ"
  ],
  [
   4716.1,
   "D",
   "KeyM",
   "ㄩ"
  ],
  [
   4740.6,
   "U",
   "KeyF",
   "ㄑ"
  ],
  [
   4789.1,
   "U",
   "KeyM",
   "ㄩ"
  ],
  [
   4835.6,
   "D",
   "Digit4",
   "ˋ"
  ],
  [
   4911.5,
   "U",
   "Digit4",
   "ˋ"
  ],
  [
   5055.2,
   "D",
   "KeyY",
   "ㄗ"
  ],
  [
   5115.5,
   "D",
   "Period",
   "ㄡ"
  ],
  [
   5143.6,
   "U",
   "KeyY",
   "ㄗ"
  ],
  [
   5191.9,
   "U",
   "Period",
   "ㄡ"
  ],
  [
   5206.6,
   "D",
   "Digit3",
   "ˇ"
  ],
  [
   5302.7,
   "U",
   "Digit3",
   "ˇ"
  ],
  [
   5310.4,
   "D",
   "KeyY",
   "ㄗ"
  ],
  [
   5358.1,
   "D",
   "Period",
   "ㄡ"
  ],
  [
   5382.0,
   "D",
   "Digit3",
   "ˇ"
  ],
  [
   5402.9,
   "U",
   "KeyY",
   "ㄗ"
  ],
  [
   5422.2,
   "U",
   "Period",
   "ㄡ"
  ],
  [
   5458.8,
   "U",
   "Digit3",
   "ˇ"
  ]
 ],
 "client": {
  "ua": "Chromium 151 / macOS",
  "timer_resolution_ms": 0.1
 }
}